{
  "schema_version": "1.0",
  "message_type": "telemetry",
  "message_id": "CWS-TEST-0123456789abcdef-1",
  "device_id": "CWS-TEST",
  "boot_id": "0123456789abcdef",
  "sequence": 1,
  "time": { "uptime_ms": 2500, "synchronized": false, "unix_s": null },
  "firmware_version": "1.0.0",
  "hardware_model": "ESP32-WROOM-32U",
  "configuration_revision": 0,
  "measurements": {
    "environment": { "valid": true, "temperature_c": 28.4, "humidity_pct": 53.0 },
    "soil": { "valid": true, "relative_moisture_pct": 69.0 },
    "battery": { "valid": true, "voltage_v": 3.89, "critical": false },
    "solar": { "valid": true, "voltage_v": 5.8 }
  }
}
